{
  "contract_version": "1.1",
  "experiment_id": "doe-bopet-tdo-ccd-2026q4",
  "line_id": "L5-bopet",
  "product_id": "film-12um",
  "recipe_id": "rcp-bopet-12um-v3",
  "objective": "将厚度稳定在 50±1.5um 的同时低于雾度上限",
  "design_type_declared": "ccd",
  "data_stage": "collected",
  "design_region": {
    "factorial_bounds": {
      "zone1_temp": [
        180,
        220
      ],
      "line_speed": [
        280,
        360
      ],
      "tdo_ratio": [
        2.5,
        3.5
      ]
    },
    "axial_alpha": 1.682,
    "design_hull": "ccd_star"
  },
  "data_file": "run_table_collected.csv",
  "factors": [
    {
      "name": "zone1_temp",
      "col": "zone1_temp",
      "type": "numeric",
      "unit": "°C",
      "min": 180,
      "max": 220,
      "levels": null,
      "role": "control",
      "expected_sign": "+",
      "physical_meaning": "TDO 北侧 Z4 加热区温度，主导张力与厚度",
      "ontology_signal": "TDO_Z4_SETPOINT",
      "platform_ref": {
        "recipe_param": "zone1_temp",
        "node_id": "dw-tdo-z4",
        "plc_tag": "TDO_Z4_SP",
        "unit_conversion": 1.0,
        "rounding": 0.1,
        "hard_limits": {
          "min": 185,
          "max": 215
        }
      }
    },
    {
      "name": "line_speed",
      "col": "line_speed",
      "type": "numeric",
      "unit": "m/min",
      "min": 280,
      "max": 360,
      "levels": null,
      "role": "control",
      "expected_sign": "-",
      "physical_meaning": "线速与张力耦合，提速会薄化",
      "ontology_signal": "MD_LINE_SPEED",
      "platform_ref": {
        "recipe_param": "line_speed",
        "node_id": "dw-mdo-01",
        "plc_tag": "MDO_SPEED_SP",
        "unit_conversion": 1.0,
        "rounding": 0.5,
        "hard_limits": {
          "min": 290,
          "max": 350
        }
      }
    },
    {
      "name": "tdo_ratio",
      "col": "tdo_ratio",
      "type": "numeric",
      "unit": "-",
      "min": 2.5,
      "max": 3.5,
      "levels": null,
      "role": "control",
      "expected_sign": "+",
      "physical_meaning": "TDO 纵横向拉伸比",
      "ontology_signal": "TDO_STRETCH_RATIO",
      "platform_ref": {
        "recipe_param": "tdo_ratio",
        "node_id": "dw-tdo-01",
        "plc_tag": "TDO_RATIO_SP",
        "unit_conversion": 1.0,
        "rounding": 0.01,
        "hard_limits": {
          "min": 2.6,
          "max": 3.4
        }
      }
    }
  ],
  "responses": [
    {
      "name": "thickness_um",
      "col": "thickness_um",
      "unit": "um",
      "goal": "target",
      "lsl": 48.0,
      "usl": 52.0,
      "target": 50.0,
      "weight": 1.0,
      "ontology_signal": "FILM_THICKNESS_MEAN",
      "platform_metric_ref": {
        "node_id": "dn-thk-01",
        "aggregation": "steady_mean"
      }
    },
    {
      "name": "haze_pct",
      "col": "haze_pct",
      "unit": "%",
      "goal": "minimize",
      "lsl": null,
      "usl": 1.8,
      "target": null,
      "weight": 0.5,
      "ontology_signal": "FILM_HAZE",
      "platform_metric_ref": {
        "node_id": "dn-haze-01",
        "aggregation": "steady_mean"
      }
    }
  ],
  "blocks": [
    "block"
  ],
  "covariates": [],
  "constraints": [
    {
      "factor": "zone1_temp",
      "type": "box",
      "min": 185,
      "max": 215,
      "hard": true,
      "reason": "安全与膜面缺陷限",
      "source": "ontology"
    },
    {
      "factor": "line_speed",
      "type": "box",
      "min": 290,
      "max": 350,
      "hard": true,
      "reason": "设备设定上下限",
      "source": "platform"
    },
    {
      "factor": "tdo_ratio",
      "type": "box",
      "min": 2.6,
      "max": 3.4,
      "hard": false,
      "reason": "工艺经验区间",
      "source": "ontology"
    }
  ],
  "replicates_col": "replicate_group",
  "run_order_col": "run_order",
  "group_col": "run_id",
  "time_col": null,
  "current_setpoint": {
    "zone1_temp": 200,
    "line_speed": 320,
    "tdo_ratio": 3.0
  },
  "baseline_source": "platform_recipe",
  "ontology": {
    "profile": "doe",
    "mode": "auto",
    "scene_key": "bopet-tdo-thickness",
    "version": null,
    "data_stage": "collected"
  },
  "provenance": {
    "platform": "RecipeWorkShop",
    "created_by": "contract-example-generator",
    "created_at": "2026-10-17T00:00:00+08:00"
  }
}
