{
  "contract_version": "1.0",
  "experiment_id": "gen-etch_fractional",
  "line_id": "etch-tool2-oxide",
  "product_id": "etch-tool2-oxide",
  "objective": "半导体刻蚀：识别关键因子并给出可执行的操作条件",
  "design_type_declared": "fractional_factorial",
  "data_stage": "collected",
  "data_file": "run_table.csv",
  "factors": [
    {
      "name": "rf_power",
      "col": "rf_power",
      "type": "numeric",
      "unit": "W",
      "role": "control",
      "expected_sign": "+",
      "physical_meaning": "rf_power",
      "platform_ref": null,
      "min": 200.0,
      "max": 400.0
    },
    {
      "name": "pressure",
      "col": "pressure",
      "type": "numeric",
      "unit": "mTorr",
      "role": "control",
      "expected_sign": "-",
      "physical_meaning": "pressure",
      "platform_ref": null,
      "min": 5.0,
      "max": 15.0
    },
    {
      "name": "gas_flow",
      "col": "gas_flow",
      "type": "numeric",
      "unit": "sccm",
      "role": "control",
      "expected_sign": "+",
      "physical_meaning": "gas_flow",
      "platform_ref": null,
      "min": 20.0,
      "max": 40.0
    },
    {
      "name": "gap",
      "col": "gap",
      "type": "numeric",
      "unit": "mm",
      "role": "control",
      "expected_sign": "-",
      "physical_meaning": "gap",
      "platform_ref": null,
      "min": 2.0,
      "max": 6.0
    }
  ],
  "responses": [
    {
      "name": "etch_depth_nm",
      "col": "etch_depth_nm",
      "unit": "nm",
      "goal": "target",
      "lsl": 475,
      "usl": 525,
      "target": 500,
      "weight": 1.0
    },
    {
      "name": "selectivity",
      "col": "selectivity",
      "unit": "-",
      "goal": "maximize",
      "lsl": 8,
      "usl": null,
      "target": null,
      "weight": 1.0
    }
  ],
  "blocks": [],
  "covariates": [
    "chamber_temp"
  ],
  "constraints": [],
  "replicates_col": "replicate_group",
  "run_order_col": "run_order",
  "group_col": "run_id",
  "time_col": null,
  "current_setpoint": {
    "rf_power": 300,
    "pressure": 10,
    "gas_flow": 30,
    "gap": 4
  },
  "baseline_source": "dataset_median",
  "design_region": {
    "factorial_bounds": {
      "rf_power": [
        200,
        400
      ],
      "pressure": [
        5,
        15
      ],
      "gas_flow": [
        20,
        40
      ],
      "gap": [
        2,
        6
      ]
    },
    "design_hull": "full_cube"
  },
  "ontology": {
    "profile": "doe",
    "mode": "auto",
    "scene_key": "etch-tool2-oxide",
    "data_stage": "collected"
  },
  "provenance": {
    "platform": "generality-corpus",
    "created_by": "generate_cases.py"
  }
}